agent_id,day,t,action,status_text_clean,review_label,review_confidence,scenario_guess,scenario_hit_evidence,friction_evidence,incidental_evidence,scene_analysis_zh
5,1,61201.0,Remove any distractions from the bedroom,"I've just finished tidying up the bedroom, enjoying the quiet and warmth of the sunny afternoon. My day was peaceful, filled with moments of reflection and contentment, though I do wish I could find the courage to tackle that new app I've been avoiding.",non_digital_or_incidental,low,none,,,,以线下行为为主，数字线索弱或仅顺带出现，判非数字更合理。
6,1,61201.0,Rest for a bit after the meal to digest,"I'm sitting comfortably at home, the sun casting a warm glow, and I've just finished a satisfying meal. Right now, I feel a blend of contentment and a touch of disappointment, as today was uneventful yet somehow left me with a restlessness that's a bit unsettling.",non_digital_or_incidental,low,none,,,,以线下行为为主，数字线索弱或仅顺带出现，判非数字更合理。
1,1,63001.0,Consider leaving a tip if the service was satisfactory,"I'm enjoying a peaceful stroll through the sunny park, savoring the tranquility of the day, though the gentle tingle of fear lingers, reminding me of the unpredictability life brings.",non_digital_or_incidental,low,none,,fear,,以线下行为为主，数字线索弱或仅顺带出现，判非数字更合理。
2,1,63001.0,Plan a simple meal based on available ingredients,"I've just returned from a leisurely stroll in the sunshine and now sit in my cozy home, feeling a sense of relief as I plan a simple meal, content with the quiet balance of the day.",non_digital_or_incidental,low,none,,,,以线下行为为主，数字线索弱或仅顺带出现，判非数字更合理。
3,1,63001.0,Enjoy the meal alone or with company if desired,"As I sit alone in my modest home on this sunny evening, I feel a quiet contentment. The calm of the day has brought a sense of peace, a mix of the melancholy that lingers in my heart alongside the moments of joy and reflection on cherished memories.",non_digital_or_incidental,low,none,,,,以线下行为为主，数字线索弱或仅顺带出现，判非数字更合理。
4,1,63001.0,Prepare for sleep by ensuring a comfortable bedroom environment,"I'm winding down at home, enjoying the pleasant evening sunshine, my mind at ease with the day's simplicity, and feeling a touch of relief for the lack of any disturbances or stress.",non_digital_or_incidental,low,none,,stress,,以线下行为为主，数字线索弱或仅顺带出现，判非数字更合理。
5,1,63001.0,Set the alarm if required for the next day,"I'm winding down in my cozy home, the sun casting a warm glow, feeling a sense of satisfaction after a peaceful day, and contemplating the quiet simplicity of my life.",non_digital_or_incidental,low,none,,,,以线下行为为主，数字线索弱或仅顺带出现，判非数字更合理。
6,1,63001.0,Prepare a comfortable sleep environment,"I'm relaxing in the comfort of my home, my heart is heavy with a mix of satisfaction and disappointment, as the quiet day passes with no big events to speak of.",non_digital_or_incidental,low,none,,,,以线下行为为主，数字线索弱或仅顺带出现，判非数字更合理。
1,1,64801.0,Return to my home,"I'm taking a leisurely stroll through the park as the sun sets, the warmth of the day fading into a tranquil evening. Despite the calm, a lingering sense of caution and the subtle weight of uncertainty accompany me as I ponder the quiet day's lack of excitement.",non_digital_or_incidental,low,none,,,,以线下行为为主，数字线索弱或仅顺带出现，判非数字更合理。
2,1,64801.0,Prepare ingredients and start cooking the meal,"I'm at home, the sun is shining, and I feel a sense of relief that today has been a day of calm. I'm preparing to cook dinner, focusing on the simple pleasures of home-cooked meals.",non_digital_or_incidental,low,none,,,,以线下行为为主，数字线索弱或仅顺带出现，判非数字更合理。
3,1,64801.0,Clean up after eating,"I'm sitting in the quiet of my modest home, the sun setting outside casting a warm glow, as I wrap up a meal, my fingers tracing the surface of the table, reflecting on the simple joys and sorrows of my days.",non_digital_or_incidental,low,none,,,,以线下行为为主，数字线索弱或仅顺带出现，判非数字更合理。
4,1,64801.0,Relax and take deep breaths to wind down for sleep,"I'm winding down after a peaceful day, sitting comfortably at home in the warm, sunny evening, feeling a sense of relief that the day passed without incident, and I'm preparing to relax and sleep.",non_digital_or_incidental,low,none,,,,以线下行为为主，数字线索弱或仅顺带出现，判非数字更合理。
5,1,64801.0,Take a warm bath or shower to relax,"As the sun dips below the horizon and the day begins to wind down, I'm sitting comfortably in my living room, a content smile on my face, having just enjoyed a peaceful, if uneventful day that's filled me with a sense of serene satisfaction. The warm bath I planned to take will be the perfect way to unwind before bedtime.",non_digital_or_incidental,low,none,,,,以线下行为为主，数字线索弱或仅顺带出现，判非数字更合理。
6,1,64801.0,Set a calming evening routine to relax the mind,"I'm winding down after a quiet day, my hands busy with adjusting my phone as I set up a calming evening routine, the gentle warmth of the evening sun streaming through the window, a mix of contentment and a touch of unease tickling my thoughts about the day's lack of major events.",non_digital_or_incidental,low,none,,,,以线下行为为主，数字线索弱或仅顺带出现，判非数字更合理。
1,1,66601.0,Return to my home,"I'm heading home now, the sun's warmth feels comforting as I take a leisurely stroll through the park, a sense of calm prevails despite the underlying tendrils of fear woven through the day's tranquil tapestry.",non_digital_or_incidental,low,none,,fear,,以线下行为为主，数字线索弱或仅顺带出现，判非数字更合理。
2,1,66601.0,Prepare ingredients and start cooking the meal,"With the sun setting over a tranquil evening, I'm in my familiar kitchen, a mix of relief and contentment washing over me as I prepare ingredients for dinner, grateful for the quiet simplicity of these moments.",non_digital_or_incidental,low,none,,,,以线下行为为主，数字线索弱或仅顺带出现，判非数字更合理。
3,1,66601.0,Reflect on the meal experience,"I am sitting comfortably at home, the sun shining outside offering a sense of warmth and calm. As I reflect on the simple meal I’ve enjoyed, my heart feels a gentle pull of nostalgia, mixed with a quiet contentment that comes from the peace of being alone yet cared for.",non_digital_or_incidental,low,none,,,,以线下行为为主，数字线索弱或仅顺带出现，判非数字更合理。
4,1,66601.0,Turn off any electronic devices or place them in a mode that reduces blue light emission,"It's now late evening, the sun still hangs in the sky, casting a soft golden glow around. I've just finished a peaceful day at home and am now setting my devices to dim to reduce the blue light before I turn in for the night, feeling content with the quiet simplicity of the day.",non_digital_or_incidental,low,none,,,,以线下行为为主，数字线索弱或仅顺带出现，判非数字更合理。
5,1,66601.0,Lie down in bed and close the curtains to create a comfortable environment,"As I sit comfortably in my room, the warm sun shining through the open curtains, I'm feeling a sense of satisfaction. After a quiet and thoughtful day, I'm looking forward to lying down in bed, letting the curtains close to signify the end of the day.",non_digital_or_incidental,low,none,,,,以线下行为为主，数字线索弱或仅顺带出现，判非数字更合理。
6,1,66601.0,Dim the lights to simulate nighttime for better sleep,"I'm settling into my home, feeling a blend of contentment from the quiet day and a touch of disappointment for its lack of excitement. I'm gradually dimming the lights, trying to create a peaceful evening for a restful night's sleep.",non_digital_or_incidental,low,none,,,,以线下行为为主，数字线索弱或仅顺带出现，判非数字更合理。
1,1,68401.0,Unlock the front door to enter the home,"As I step into the sun-kissed evening, the warmth soothes my aging bones, yet a shadow of fear lingers as I fumble with my old phone, trying to navigate the digital world with its cryptic codes and unwelcoming screens.",non_digital_or_incidental,low,none,,fear,,以线下行为为主，数字线索弱或仅顺带出现，判非数字更合理。
2,1,68401.0,Serve the prepared meal,"As the sun dips below the horizon, I find myself in the comfort of my home, the warm 23-degree air wrapping around me. Despite the day's mix of emotions, the simple act of serving a meal feels like a balm to the chaotic world outside, offering a sense of relief and balance.",non_digital_or_incidental,low,none,,,,以线下行为为主，数字线索弱或仅顺带出现，判非数字更合理。
3,1,68401.0,Prepare the sleeping environment,"I am settling into my evening, with the warmth of the sun still shining through the window, my body aching for rest as I carefully arrange the sleeping environment, seeking comfort and a sense of normalcy in the familiar.",non_digital_or_incidental,low,none,,,,以线下行为为主，数字线索弱或仅顺带出现，判非数字更合理。
4,1,68401.0,Set up the sleep environment to a quiet and dark place,"As the sun sets and the world outside my window is bathed in golden hues, I find myself at home, content to prepare my sleeping space—a quiet, dim sanctuary where I can retreat and let the day's trivialities fade away. Today has been a tranquil respite from the chaos, and I feel a comforting sense of relief in its simplicity.",non_digital_or_incidental,low,none,,,,以线下行为为主，数字线索弱或仅顺带出现，判非数字更合理。
5,1,68401.0,Relax in the living room with a book,"As the sun sets and the living room grows dim, I settle into the cozy familiarity of my couch, my heart brimming with a contented peace from the uneventful yet reflective day, sipping a cup of tea and losing myself in a good book.",non_digital_or_incidental,low,none,,,,以线下行为为主，数字线索弱或仅顺带出现，判非数字更合理。
6,1,68401.0,Prepare the bedroom with comfortable sleep conditions,"I'm winding down for the evening, my fingers deftly navigating the settings of my smartphone to ensure the bedroom is just right for a comfortable night's sleep, while my mind drifts through a mix of contentment and a touch of unease, pondering the quiet day and the uncertainty that comes with it.",non_digital_or_incidental,low,none,,,,以线下行为为主，数字线索弱或仅顺带出现，判非数字更合理。
1,1,70201.0,Change into comfortable night attire,"I'm settling into my night at home, feeling a mix of contentment at the quiet day and a lingering unease that keeps me alert. I'm changing into my cozy night clothes, seeking the comfort of routine as the sun sets outside.",non_digital_or_incidental,low,notification_risk_interrupt,notification_risk_interrupt:alert,,,以线下行为为主，数字线索弱或仅顺带出现，判非数字更合理。
2,1,70201.0,Enjoy the meal alone or invite someone,"As I sit at home after a day of calm and balanced emotions, the sun outside casts a warm glow through my window, and I find myself pondering the quiet solitude. Despite the day's rollercoaster of feelings, I feel a sense of relief in the simple pleasure of a meal alone.",non_digital_or_incidental,low,none,,,,以线下行为为主，数字线索弱或仅顺带出现，判非数字更合理。
3,1,70201.0,Change into comfortable sleepwear,"At 7:30 PM, I find myself settled in my modest home, the sun casting a warm glow outside, and I'm feeling a blend of comfort and melancholy as I prepare to retire for the night, the familiar peace of solitude offering solace amidst the day's gentle tranquility.",non_digital_or_incidental,low,none,,,,以线下行为为主，数字线索弱或仅顺带出现，判非数字更合理。
4,1,70201.0,Perform a short relaxation routine or read a book,"At the serene hour of 7:30 PM, as the sun bathes the day in a gentle, warm glow and I sit comfortably at home, I find myself unwinding, feeling a tranquil relief after a peaceful day that has passed without any disturbances, and I'm now content to either enjoy a brief moment of relaxation or dive into a captivating book, cherishing the simplicity of the uneventful moments.",non_digital_or_incidental,low,none,,,,以线下行为为主，数字线索弱或仅顺带出现，判非数字更合理。
5,1,70201.0,Relax in the living room with a book,"As I settle into the cozy living room with a cup of tea and a book, I feel a warm wave of satisfaction, basking in the quiet simplicity of this uneventful yet contentful evening.",non_digital_or_incidental,low,none,,,,以线下行为为主，数字线索弱或仅顺带出现，判非数字更合理。
6,1,70201.0,Relax in a comfortable position on the sofa,"As I relax in my comfortable sofa, the warmth of the sun filtering through the window offers a serene feeling, despite the mixed emotions that dance through my mind, a quiet day leaving me content yet longing for some excitement.",non_digital_or_incidental,low,none,,,,以线下行为为主，数字线索弱或仅顺带出现，判非数字更合理。
1,1,72001.0,Set up a comfortable sleeping environment,"As I wrap up a tranquil day, a mix of contentment and a lingering fear eases my thoughts as I settle into preparing a cozy bedroom for sleep.",non_digital_or_incidental,low,none,,fear,,以线下行为为主，数字线索弱或仅顺带出现，判非数字更合理。
2,1,72001.0,Prepare for sleep by ensuring the bedroom is dark and cool,"After a long day, I'm settled at home, preparing for the evening by turning down the lights and ensuring the room is cool for sleep, feeling a mix of relief that today passed peacefully without much drama, and a quiet gratitude for the routine of home.",non_digital_or_incidental,low,none,,,,以线下行为为主，数字线索弱或仅顺带出现，判非数字更合理。
3,1,72001.0,Relax with deep breathing or meditation,"'m relaxing at home, feeling a mix of peace and nostalgia as I reflect on my husband's memories. The tranquil evening is soothing my nerves, making me content with the simple joys of rest and reflection.",non_digital_or_incidental,low,none,,,,以线下行为为主，数字线索弱或仅顺带出现，判非数字更合理。
4,1,72001.0,Get into bed at a consistent time to establish a sleep routine,"As the sun sets on this tranquil evening, I'm winding down, my mind a mix of quiet relief and contentment from a day with no major disturbances. I find myself ready to retreat to the comfort of my home, hoping to settle into a consistent bedtime routine.",non_digital_or_incidental,low,none,,,,以线下行为为主，数字线索弱或仅顺带出现，判非数字更合理。
5,1,72001.0,Set the room temperature to 23C to ensure comfort,"Today, as the sun sets over the warm evening, I'm settled at home, contentedly adjusting the room's temperature just right with a sense of satisfaction, reflecting on a peaceful day that brought a mix of emotions.",non_digital_or_incidental,low,none,,,,以线下行为为主，数字线索弱或仅顺带出现，判非数字更合理。
6,1,72001.0,Prepare a cup of herbal tea,"I'm winding down at home, the day's quietude bringing a mix of contentment and an undercurrent of mild disappointment. With the sun still shining outside, I'm preparing a soothing cup of herbal tea, my fingers gently tracing the intricate patterns on the mug.",non_digital_or_incidental,low,none,,,,以线下行为为主，数字线索弱或仅顺带出现，判非数字更合理。
1,1,73801.0,Lie down in bed and close the bedroom door,"As I lie down in my bed, the quietude of the evening envelops me with a mix of contentment and an undercurrent of unease, a reflection of the tranquility of today's day juxtaposed against a lingering sense of anxiety.",non_digital_or_incidental,low,none,,anxiety,,以线下行为为主，数字线索弱或仅顺带出现，判非数字更合理。
2,1,73801.0,Relax the body by taking a warm shower or bath,"I'm winding down at 8:30 PM, the sun still shining brightly outside, as I prepare to relax with a warm bath to ease my day's tensions. Relief washes over me, the balance of emotions I've felt today—a mix of sadness, joy, fear, and disgust—feels almost serene now that the day's routine is behind me.",non_digital_or_incidental,low,none,,fear,,以线下行为为主，数字线索弱或仅顺带出现，判非数字更合理。
3,1,73801.0,Lie down in the bed and close the bedroom curtains,"I am settled in my home, the sun setting outside, the warmth of the room enveloping me as I prepare to rest. The quietude is a soothing balm to the day's uncertainties, and I find solace in the simple act of lying down and closing the curtains.",non_digital_or_incidental,low,none,,,,以线下行为为主，数字线索弱或仅顺带出现，判非数字更合理。
4,1,73801.0,Prepare the bedroom for sleep,"As I prepare for bed, I find myself tidying up the bedroom, my mind at ease due to the tranquil day, and I'm content with the simplicity of it all.",non_digital_or_incidental,low,none,,,,以线下行为为主，数字线索弱或仅顺带出现，判非数字更合理。
5,1,73801.0,Prepare the bed with a comfortable pillow and sheet,"As I sit in the cozy comfort of my home, the sun still shining brightly outside, I'm contently preparing my bed with a soft pillow and fresh sheets, feeling a sense of satisfaction after a quiet and thoughtful day filled with reflection.",non_digital_or_incidental,low,none,,,,以线下行为为主，数字线索弱或仅顺带出现，判非数字更合理。
6,1,73801.0,Turn off all electronic devices to minimize distractions,"At this serene hour of 20:30, I find myself contemplating the day's quietude, my 66-year-old mind flickering between the warmth of a successful day and a faint unease over the mundane flow of events. With my devices powered down, I'm at peace, savoring the quiet, as I prepare to sleep, my body ready to embrace the comfort of my home.",non_digital_or_incidental,low,none,,,,以线下行为为主，数字线索弱或仅顺带出现，判非数字更合理。
1,1,75601.0,Begin to relax and wind down for sleep,"I'm wrapping up my evening, feeling a mix of contentment and a lingering anxiety, as I sit in the comfort of my home, looking forward to a restful night.",non_digital_or_incidental,low,none,,anxiety,,以线下行为为主，数字线索弱或仅顺带出现，判非数字更合理。
2,1,75601.0,Change into comfortable night clothing,"I've just settled into my home, the warm 23-degree night air soothing after a long day, and I'm ready to don my nightclothes, the calm of the evening wrapping around me like a gentle comfort, a relief from the unpredictability of the world outside.",non_digital_or_incidental,low,none,,,,以线下行为为主，数字线索弱或仅顺带出现，判非数字更合理。
3,1,75601.0,Turn off all electronic devices to minimize distractions,"I'm settled in my cozy home, the tranquil evening sun casting a warm glow through the windows, as I carefully turn off my electronic devices, seeking solace and peace in the quiet of the night. My heart is a tapestry of sorrow mixed with moments of joy, a testament to the quiet resilience I've found in my twilight years.",non_digital_or_incidental,low,none,,,,以线下行为为主，数字线索弱或仅顺带出现，判非数字更合理。
4,1,75601.0,Set the alarm clock for morning,"After a peaceful day that was as uneventful as it was comforting, I'm now snugly settled at home, feeling a sense of relief. As I prepare for the night, I'm setting my alarm for tomorrow with a touch of relief, grateful for the simplicity of these quiet evenings.",non_digital_or_incidental,low,none,,,,以线下行为为主，数字线索弱或仅顺带出现，判非数字更合理。
5,1,75601.0,Perform a brief stretching routine to ease body tension,"As the sun sets, I'm comfortably settled at home, my body gently stretched in the warm 23-degree air, feeling content and appreciative of today's tranquility.",non_digital_or_incidental,low,none,,,,以线下行为为主，数字线索弱或仅顺带出现，判非数字更合理。
6,1,75601.0,Adjust the room temperature to a comfortable level,"I'm settled in my living room, toggling the thermostat to ensure a cozy night's sleep as the sun sets and the sunlit room begins to cool. As I adjust the temperature, I'm struck by a mix of contentment and a hint of unease; the quiet day has passed without much excitement, yet it's a relief to have completed my routine tasks.",non_digital_or_incidental,low,none,,,,以线下行为为主，数字线索弱或仅顺带出现，判非数字更合理。
1,1,77401.0,Relax mind for better sleep,"I'm settled in my cozy home, the sun is still shining outside, and I'm feeling a mix of contentment and unease as I contemplate the day's quiet passage, eager to unwind for a peaceful night's rest.",non_digital_or_incidental,low,none,,,,以线下行为为主，数字线索弱或仅顺带出现，判非数字更合理。
2,1,77401.0,Use the restroom to eliminate the need to get up during the night,"It's a tranquil evening, and after a day balancing a mix of emotions, I've just settled in for the night, looking forward to a peaceful sleep. I've taken care of my bodily needs and am now comfortably nestled in my home, feeling a sense of relief as the day's unknowns have passed and the unknowns of tomorrow await.",non_digital_or_incidental,low,none,,,,以线下行为为主，数字线索弱或仅顺带出现，判非数字更合理。
3,1,77401.0,Attempt to fall asleep in a calm and quiet state,"As I settle into my comfortable armchair, the gentle warmth of the sunlight seeping through the curtains and the soft evening quietness wrap around me, I feel a calmness settle in despite the lingering sadness and uncertainty. I focus on taking deep, even breaths, allowing my thoughts to drift to the memories of my husband, a comforting anchor in my life.",non_digital_or_incidental,low,none,,,,以线下行为为主，数字线索弱或仅顺带出现，判非数字更合理。
4,1,77401.0,Ensure all necessary documents are within reach,"It's late afternoon, and I've just taken a brief walk to clear my mind before settling down for the night. The day's tranquility brings a sense of relief, and as I glance over the familiar apps on my phone, I feel reassured knowing I've taken the necessary precautions for account security.",weak_digital_context,low,login_auth_security,login_auth_security:account,,,有数字接触但更多是背景/情绪描述，数字任务不是当前主动作，未进 attempt 有一定合理性。
5,1,77401.0,Take a warm bath or shower to help relax,"I'm relaxing at home, feeling a sense of satisfaction after a quiet day. I'm contemplating a warm bath to unwind, as it's a simple pleasure I cherish.",non_digital_or_incidental,low,none,,,,以线下行为为主，数字线索弱或仅顺带出现，判非数字更合理。
6,1,77401.0,Practice deep breathing exercises to calm the mind,"As I sit in the quiet of my home at this peaceful hour, my mind is gently tending to my well-being with deep breathing exercises, a blend of contentment and a touch of melancholy from a day devoid of major incidents.",non_digital_or_incidental,low,none,,,,以线下行为为主，数字线索弱或仅顺带出现，判非数字更合理。
1,1,79201.0,Prepare a comfortable sleeping environment,"I've spent the evening in a tranquil state, enjoying the peaceful evening, yet an undercurrent of fear lingers, making me extra cautious as I prepare to sleep, despite the day's lack of excitement.",non_digital_or_incidental,low,none,,fear,,以线下行为为主，数字线索弱或仅顺带出现，判非数字更合理。
2,1,79201.0,Set the alarm if needed for the next morning,"I'm settled in my living room, feeling a serene relief after a day that seemed to evenly distribute its emotional spectrum. The sun is setting outside, and I'm contemplating setting an alarm just in case, ready to rest and anticipate the tranquility of the upcoming night.",non_digital_or_incidental,low,none,,,,以线下行为为主，数字线索弱或仅顺带出现，判非数字更合理。
3,1,79201.0,Relax and prepare the sleeping environment,"As the sun sets, I am taking the time to prepare my home for sleep, my heart weighted by a mix of sadness and contentment, while my mind is at peace after a day of relative tranquility.",non_digital_or_incidental,low,none,,,,以线下行为为主，数字线索弱或仅顺带出现，判非数字更合理。
4,1,79201.0,Switch off all lights and electronic devices,"I'm winding down for the night, feeling a wave of relief as the quiet simplicity of today's uneventful day washes over me, prompting me to turn off all lights and devices in my simple, straightforward way.",non_digital_or_incidental,low,none,,,,以线下行为为主，数字线索弱或仅顺带出现，判非数字更合理。
