agent_id,day,t,action,status_text_clean,review_label,review_confidence,scenario_guess,scenario_hit_evidence,friction_evidence,incidental_evidence,scene_analysis_zh
4,3,19801.0,Prepare and cook breakfast,"I'm starting my day at 5:30 AM, feeling a sense of relief from the peaceful night, and as I prepare breakfast, I take comfort in the simple and clear operations of the kitchen, appreciating the tranquility of this sunny morning.",non_digital_or_incidental,low,none,,,,以线下行为为主，数字线索弱或仅顺带出现，判非数字更合理。
5,3,19801.0,Set the table for dinner,"I am setting the table at home, the sun is casting a warm glow, and despite today's moments of sadness and fear, my heart feels a quiet contentment, grateful for this simple evening ahead.",non_digital_or_incidental,low,none,,fear,,以线下行为为主，数字线索弱或仅顺带出现，判非数字更合理。
6,3,19801.0,Close the eyes and begin to relax,"I'm settling into a peaceful morning, the sun shining warmly as I prepare to relax and unwind, my mind reflecting on the quiet day with a mix of contentment and a touch of wistfulness.",non_digital_or_incidental,low,none,,,,以线下行为为主，数字线索弱或仅顺带出现，判非数字更合理。
1,3,21601.0,Dim the lights to create a conducive sleep environment,"I'm settling in for the night, the sun's warmth has faded, and I'm feeling a mix of contentment and quiet anxiety, adjusting my environment to find comfort and peace in the calm after a day of tranquility.",non_digital_or_incidental,low,none,,anxiety,,以线下行为为主，数字线索弱或仅顺带出现，判非数字更合理。
2,3,21601.0,Enjoy the breakfast at home,"I'm sipping my coffee in the comfort of my home, the warmth of the morning sun streaming in through the window, feeling a sense of contentment and relief as I start the day in tranquility.",non_digital_or_incidental,low,none,,,,以线下行为为主，数字线索弱或仅顺带出现，判非数字更合理。
3,3,21601.0,Set the dining table,"As the sun peeks through the curtains, I sit in my cozy living room, setting the dining table with a sense of peace. Today's tranquility, punctuated by brief, poignant joys, fills me with a deep, contented satisfaction.",non_digital_or_incidental,low,none,,,,以线下行为为主，数字线索弱或仅顺带出现，判非数字更合理。
4,3,21601.0,Set the table with a nice breakfast spread,"I've just finished setting up a warm, inviting breakfast on the table. The morning sun shines in through the window, casting a comforting glow, and the peacefulness of this simple act fills me with a sense of contentment and gratitude for the quiet beauty of my morning.",non_digital_or_incidental,low,none,,,,以线下行为为主，数字线索弱或仅顺带出现，判非数字更合理。
5,3,21601.0,Take time to savor the meal and reflect on the day,"As I sit down for my meal at home, the sun shining outside casts a warm glow on the room. Despite today's uneventful yet poignant occurrences, I'm feeling a deep sense of gratitude, taking this moment to cherish the quiet and simpler aspects of life.",non_digital_or_incidental,low,none,,,,以线下行为为主，数字线索弱或仅顺带出现，判非数字更合理。
6,3,21601.0,Prepare the ingredients for breakfast,"As the sun peeks over the horizon, I'm at home, stirring the pot of oatmeal for breakfast, the quiet of the early morning matching the calmness in my heart, a blend of contentment with the simple day ahead and a touch of disappointment at the lack of excitement.",non_digital_or_incidental,low,none,,,,以线下行为为主，数字线索弱或仅顺带出现，判非数字更合理。
1,3,23401.0,Set an alarm for the morning if necessary,"I'm enjoying the serene morning, the gentle sun casting a warm glow over the quiet park where I walk, my mind filled with a mix of mild anxiety and a deep sense of peace.",non_digital_or_incidental,low,none,,anxiety,,以线下行为为主，数字线索弱或仅顺带出现，判非数字更合理。
2,3,23401.0,Consider if there are any leftover ingredients for a light lunch,"I'm sitting at home with the sun shining through the window, feeling a sense of relief that today has been uneventful. I ponder over the simplicity of my morning, thinking about preparing a light lunch with whatever ingredients I have left.",non_digital_or_incidental,low,none,,,,以线下行为为主，数字线索弱或仅顺带出现，判非数字更合理。
3,3,23401.0,Serve the meal,"At dawn, I sit comfortably in my cozy home, the warm sunlight filtering through the window, as I savor the peace of this tranquil morning. The quiet moments of solitude are bittersweet, but I find satisfaction in the simple act of resting and reflecting, memories of my husband's love occasionally softening the edges of my solitude.",non_digital_or_incidental,low,none,,,,以线下行为为主，数字线索弱或仅顺带出现，判非数字更合理。
4,3,23401.0,Serve the breakfast and enjoy it,"I'm sipping on my morning coffee, enjoying the peaceful, sunny morning at home. Today feels like a gentle reminder to appreciate the simple joys in life, and I'm at ease, content to serve myself breakfast and savor these quiet moments.",non_digital_or_incidental,low,none,,,,以线下行为为主，数字线索弱或仅顺带出现，判非数字更合理。
5,3,23401.0,Wash the dishes after eating,"I'm enjoying a quiet morning at home, the sun casting a warm glow through the window, and I feel a sense of contentment after a rather peaceful day, looking forward to taking care of the dishes after I eat.",non_digital_or_incidental,low,none,,,,以线下行为为主，数字线索弱或仅顺带出现，判非数字更合理。
6,3,23401.0,Cook breakfast using the stove,"I'm starting my day with a contented satisfaction, as I prepare a homely breakfast with a sunny, 23C morning to my side, a blend of peace and a hint of longing for more excitement in life's quiet moments.",non_digital_or_incidental,low,none,,,,以线下行为为主，数字线索弱或仅顺带出现，判非数字更合理。
1,3,25201.0,"Attempt to sleep, allowing the body to rest","As the sun rises, I find myself settled at home, my body weary from a long day, eager to embrace the comfort of my bed. The peaceful morning sun casts a warm glow on my face, and despite a lingering anxiety about the day's uncertainties, the feeling of safety and contentment that comes with familiarity is soothing.",non_digital_or_incidental,low,none,,anxiety,,以线下行为为主，数字线索弱或仅顺带出现，判非数字更合理。
2,3,25201.0,"If needed, prepare a light lunch","At 71, with the sun shining and a comfortable 23°C outside, I'm settled at home, enjoying the quiet after a morning of community coordination and tech frustrations. Today, I'm content to savor the calmness and plan to prepare a light lunch, a simple pleasure that feels especially satisfying.",non_digital_or_incidental,low,none,,frustrations,,以线下行为为主，数字线索弱或仅顺带出现，判非数字更合理。
3,3,25201.0,Sit down and eat,"I'm settling down to enjoy a meal at home, feeling a contented tranquility as I reflect on the day's peacefulness, and I savor the warmth of a simple, serene afternoon, even as the memories of my husband occasionally stir gentle pangs of sadness.",non_digital_or_incidental,low,none,,,,以线下行为为主，数字线索弱或仅顺带出现，判非数字更合理。
4,3,25201.0,Clean up after breakfast,"As the sun rises over my quiet neighborhood, I'm settling into the peaceful rhythm of my day, my hands moving methodically through the cleaning routine after breakfast, a simple pleasure that I find deeply satisfying despite the uncertainty of the world beyond my doors.",non_digital_or_incidental,low,none,,,,以线下行为为主，数字线索弱或仅顺带出现，判非数字更合理。
5,3,25201.0,Retire to my bedroom and lie down,"I am returning to the quiet sanctuary of my bedroom, feeling grateful for a day that was peaceful yet touched with sadness and a touch of fear. As the sun shines and the weather is warm, I find solace in reflecting on the simpler moments of life, appreciating the day's tranquility.",non_digital_or_incidental,low,none,,fear,,以线下行为为主，数字线索弱或仅顺带出现，判非数字更合理。
6,3,25201.0,Serve breakfast on the dining table,"I'm enjoying a serene morning at home, the sun casting a warm glow as I prepare a satisfying breakfast, feeling a mix of contentment and a touch of longing for the day's quiet simplicity.",non_digital_or_incidental,low,none,,,,以线下行为为主，数字线索弱或仅顺带出现，判非数字更合理。
1,3,27001.0,Prepare a healthy breakfast,"As I step out for my morning walk, the sunlight feels welcoming, and I'm already thinking about preparing a healthy breakfast at home—my day is starting out tranquilly, despite the usual anxiety that the unknown brings.",non_digital_or_incidental,low,none,,anxiety,,以线下行为为主，数字线索弱或仅顺带出现，判非数字更合理。
2,3,27001.0,Reflect on the day's activities and plan for the rest of the day,"This morning, basking in the sunny weather, I find myself at home, feeling a sense of relief from the day's quiet calm and contentment. With my retirement and limited tech proficiency, I take a moment to ponder the day's activities and plan my tranquil afternoon ahead.",non_digital_or_incidental,low,none,,,,以线下行为为主，数字线索弱或仅顺带出现，判非数字更合理。
3,3,27001.0,Clean up after eating,"I am enjoying a quiet morning at home, the sun shining through the window, as I sit down to have my breakfast, my heart warmed by the sense of tranquility and the small joys I find in the simplicity of my day.",non_digital_or_incidental,low,none,,,,以线下行为为主，数字线索弱或仅顺带出现，判非数字更合理。
4,3,27001.0,Reflect on the day ahead while having a leisurely breakfast,"As the sun rises and the morning air feels crisp, I sip my coffee and take a moment to appreciate the peace that seems to settle over the city. With a calm and contented heart, I reflect on the tranquil start to my day, knowing I'll enjoy a comfortable breakfast at home without any pressing matters on my mind.",non_digital_or_incidental,low,none,,,,以线下行为为主，数字线索弱或仅顺带出现，判非数字更合理。
5,3,27001.0,Close the curtains to ensure a dark and comfortable sleep environment,"As I sit at home basking in the gentle warmth of a sunny morning, I gently draw the curtains to envelop my room in the quiet darkness I cherish for my restful slumber. My heart, heavy with a blend of melancholy and tranquility, reflects on the uneventful day that's been, appreciating the moments of solitude and gratitude for life's simpler pleasures.",non_digital_or_incidental,low,none,,,,以线下行为为主，数字线索弱或仅顺带出现，判非数字更合理。
6,3,27001.0,Check the comfort of the bed,"I'm enjoying a peaceful morning at home, with the sun shining and the temperature just right, taking satisfaction in the comfort of my bed after a day that was quiet and contemplative.",non_digital_or_incidental,low,none,,,,以线下行为为主，数字线索弱或仅顺带出现，判非数字更合理。
1,3,28801.0,Set the table with plates and utensils,"As I gently set the table with plates and utensils, a serene feeling washes over me. The sun shines warmly outside, and despite the quiet day, I find myself both anxious and at peace, the world's quiet hum filling the room with a comforting sense of normalcy.",non_digital_or_incidental,low,none,,anxious,,以线下行为为主，数字线索弱或仅顺带出现，判非数字更合理。
2,3,28801.0,Check current meal plan for today,"I sit comfortably at home, the sun streaming in as I review today's meal plan, feeling a serene satisfaction knowing I've navigated another day of relative tranquility.",non_digital_or_incidental,low,none,,,,以线下行为为主，数字线索弱或仅顺带出现，判非数字更合理。
3,3,28801.0,Set up a comfortable reading area with a good light source,"In this serene morning, I am settling into a cozy nook in my home, basking in the warm sunlight, and relishing the quiet comfort of my personal haven. The peace of the day, punctuated by my reflections, fills me with a contented serenity.",non_digital_or_incidental,low,none,,,,以线下行为为主，数字线索弱或仅顺带出现，判非数字更合理。
4,3,28801.0,Relax in the living room with a book,"feel comfortable and at ease as I sit in my cozy living room, the sunlight filtering through the window, a feeling of relief washing over me. I've taken a moment to enjoy the peaceful silence and simplicity of this quiet day.",non_digital_or_incidental,low,none,,,,以线下行为为主，数字线索弱或仅顺带出现，判非数字更合理。
5,3,28801.0,Set the alarm clock for an appropriate wake-up time,"I am gently setting my alarm clock with a mix of gratitude and introspection, knowing that today I can enjoy the serene quiet of my home and the beauty of the sunny weather.",non_digital_or_incidental,low,none,,,,以线下行为为主，数字线索弱或仅顺带出现，判非数字更合理。
6,3,28801.0,Adjust the room temperature to 23C if necessary,"I'm enjoying a peaceful morning at home, adjusting the room temperature to a cozy 23C, feeling a sense of satisfaction from the tranquility of a quiet day, while a mix of joy and mild disappointment lingers in the background.",non_digital_or_incidental,low,none,,,,以线下行为为主，数字线索弱或仅顺带出现，判非数字更合理。
1,3,30601.0,Sit down and begin the meal,"I'm sipping tea at home, feeling a serene satisfaction amidst the tranquility of the early morning sun. The peace that blankets my days, despite the gnawing anxieties about life's uncertainties, makes me grateful for these moments of quiet contentment.",non_digital_or_incidental,low,none,,,,以线下行为为主，数字线索弱或仅顺带出现，判非数字更合理。
2,3,30601.0,Prepare meal according to plan,"I am home, the sun is shining brightly outside, and I feel a sense of relief as I prepare a meal at home, glad that it's a quiet day without any disturbances or stress.",non_digital_or_incidental,low,none,,stress,,以线下行为为主，数字线索弱或仅顺带出现，判非数字更合理。
3,3,30601.0,Begin reading a personal journal or book to reflect on,"As I sit in the comfort of my home, the sun's gentle warmth seeps through the window, I reach for my journal with a sense of calm and contentment, ready to delve into the quiet moments of reflection and remembrance.",non_digital_or_incidental,low,none,,,,以线下行为为主，数字线索弱或仅顺带出现，判非数字更合理。
4,3,30601.0,Set the alarm clock for 10 hours of rest,"As the sun casts a warm, bright glow through my living room, I find myself setting my alarm for a peaceful 10-hour slumber. I feel a wave of relief wash over me, knowing that today, like many others before, has been serene and incident-free, a gentle reminder to cherish these tranquil moments of life's quiet simplicity.",non_digital_or_incidental,low,none,,,,以线下行为为主，数字线索弱或仅顺带出现，判非数字更合理。
5,3,30601.0,Turn off any electronic devices that may interfere with sleep,"I'm sitting in my living room, the sun streaming through the window, feeling a sense of introspection and peace as I reflect on the day's events. It's a quiet moment, and I'm turning off my electronic devices to prepare for a restful sleep.",non_digital_or_incidental,low,none,,,,以线下行为为主，数字线索弱或仅顺带出现，判非数字更合理。
6,3,30601.0,Prepare for sleep by dimming lights and ensuring a quiet environment,"I'm winding down at home, the sun shining outside, feeling a blend of contentment and a touch of wistfulness. I'm preparing for a good night's rest, gradually dimming the lights and seeking a quiet space to reflect on the day's simple yet meaningful moments.",non_digital_or_incidental,low,none,,,,以线下行为为主，数字线索弱或仅顺带出现，判非数字更合理。
1,3,32401.0,"Enjoy the meal alone, appreciating the tranquility of the day","I am enjoying a tranquil meal alone at home, the sun shining outside offering a comforting backdrop to my solitude. The meal's simplicity and the quietude of the day are especially soothing, as they remind me of the quiet times I cherish.",non_digital_or_incidental,low,none,,,,以线下行为为主，数字线索弱或仅顺带出现，判非数字更合理。
2,3,32401.0,Ensure all ingredients are ready,"I am at home, preparing to eat, the morning sun feels warm, and I feel a sense of contentment, knowing that today's routine is a break from any complications I've dealt with before.",non_digital_or_incidental,low,none,,,,以线下行为为主，数字线索弱或仅顺带出现，判非数字更合理。
3,3,32401.0,Begin reading a personal journal or book to reflect on,"As I sit alone in the quiet of my living room, the morning sun warming my skin, I am reaching for my journal, my fingers hesitantly tracing the familiar lines of words I've penned in days past, a simple, soothing ritual that helps me grapple with the quietude and solitude of my life.",non_digital_or_incidental,low,none,,,,以线下行为为主，数字线索弱或仅顺带出现，判非数字更合理。
4,3,32401.0,Prepare a calming evening routine,"I'm at home, the sun is shining through the window, and I've just finished a peaceful day with no significant events. As I prepare for the evening, I feel a sense of relief, appreciating the quiet simplicity of my life and the tranquility it brings.",non_digital_or_incidental,low,none,,,,以线下行为为主，数字线索弱或仅顺带出现，判非数字更合理。
5,3,32401.0,Practice deep breathing exercises to promote relaxation,"I am relaxing at home in the warm, sunny afternoon, my body sinking into the comfort of my chair as I practice deep breathing exercises, allowing my thoughts to drift to the quieter, simpler moments of my life.",non_digital_or_incidental,low,none,,,,以线下行为为主，数字线索弱或仅顺带出现，判非数字更合理。
6,3,32401.0,Lie down in bed in a comfortable position,"Today, I'm lounging comfortably in my home, the sun's warm rays filling the room, feeling a content satisfaction from a day spent quietly at leisure, my mind wandering from the small joys to the subtle fears that life quietly whispers.",non_digital_or_incidental,low,none,,,,以线下行为为主，数字线索弱或仅顺带出现，判非数字更合理。
1,3,34201.0,Clear the table after finishing the meal,"I'm sitting at my table, the sun shining warmly through the window, savoring a meal at home after a peaceful day. With a mix of mild joy and a lingering anxiety about life's uncertainties, I find solace in the quietude, content with the simplicity of the day and the safety of familiar surroundings.",non_digital_or_incidental,low,none,,anxiety,,以线下行为为主，数字线索弱或仅顺带出现，判非数字更合理。
2,3,34201.0,Start cooking the main dish,"I'm at home, the sun is shining, and despite my frustrations with tech sometimes, I'm feeling a sense of relief as I prepare to cook my main dish for dinner, enjoying the peaceful calm of the day.",non_digital_or_incidental,low,none,,frustrations,,以线下行为为主，数字线索弱或仅顺带出现，判非数字更合理。
3,3,34201.0,Listen to soothing music to enhance the reflective mood,"I am sitting quietly in my cozy home, the morning sun streaming in through the window, as I listen to soft, soothing music. Today, in the tranquility of this peaceful moment, I find solace in simple reflection, my heart occasionally lifted by cherished memories of my dear husband.",non_digital_or_incidental,low,none,,,,以线下行为为主，数字线索弱或仅顺带出现，判非数字更合理。
4,3,34201.0,Turn off all electronic devices an hour before sleep,"I'm settled at home, savoring the peace and simplicity of a tranquil day as I prepare to unwind, turning off my devices an hour before sleep, and feeling a profound sense of relief that nothing extraordinary marred this calm afternoon.",non_digital_or_incidental,low,none,,,,以线下行为为主，数字线索弱或仅顺带出现，判非数字更合理。
5,3,34201.0,Gently ease into a resting position,"I'm comfortably settled in my living room, the sun casting a warm glow, as I sit with a sense of quiet reflection. The day's uneventfulness has given me a moment to ponder, appreciating the quiet simplicity of life.",non_digital_or_incidental,low,none,,,,以线下行为为主，数字线索弱或仅顺带出现，判非数字更合理。
6,3,34201.0,"Begin to relax the body and mind, ready to fall asleep","At 9:30 in the morning, with the sun shining and the temperature at a comfortable 23 degrees, I'm settling in at home, my mind reflecting on the day's quietude and the blend of small joys and fears that came with it, feeling a contentment in the simple, uneventful nature of the day.",non_digital_or_incidental,low,none,,,,以线下行为为主，数字线索弱或仅顺带出现，判非数字更合理。
1,3,36001.0,Reflect on the meal and the day's tranquility,"I'm leisurely enjoying a quiet morning in the park, the warm sun casting a gentle glow, and as I reflect on my simple meal at home, I feel a sense of calm and contentment, grateful for the tranquility amidst the peaceful routine of my retirement days.",non_digital_or_incidental,low,none,,,,以线下行为为主，数字线索弱或仅顺带出现，判非数字更合理。
2,3,36001.0,Set the table for eating,"At the kitchen, I'm setting the table with a content heart, feeling grateful for the quiet calm that today has brought, even though I've encountered no challenges that would test my patience.",non_digital_or_incidental,low,none,,,,以线下行为为主，数字线索弱或仅顺带出现，判非数字更合理。
3,3,36001.0,Engage in deep breathing exercises to calm the mind,"I am sitting comfortably in my modest living room, the sun streaming in through the window, as I engage in gentle breathing exercises, finding solace in the quiet simplicity of the morning calm. A wave of fondness washes over me as I reflect on the quiet joy of my day, my heart warmed by memories of my husband.",non_digital_or_incidental,low,none,,,,以线下行为为主，数字线索弱或仅顺带出现，判非数字更合理。
4,3,36001.0,Ensure the room is comfortable for sleep,"Relieved by the serene day, I'm making sure my room is snug for a comfortable sleep, enjoying the quiet simplicity of a peaceful evening after a stress-free day.",non_digital_or_incidental,low,none,,stress,,以线下行为为主，数字线索弱或仅顺带出现，判非数字更合理。
5,3,36001.0,Prepare the sleeping environment,"I'm quietly at home, the sun is shining, and I'm preparing for bed. Today's calm has me introspective, reflecting on the quieter moments in life, feeling a mix of sadness and gratitude.",non_digital_or_incidental,low,none,,,,以线下行为为主，数字线索弱或仅顺带出现，判非数字更合理。
6,3,36001.0,Plan the menu for lunch based on ingredients available,"As I sit in the comfort of my living room, the morning sun streaming in, I'm lost in contemplation, a satisfying feeling of contentment washing over me. I'm planning out a simple yet delightful lunch menu, appreciating the quiet of today.",non_digital_or_incidental,low,none,,,,以线下行为为主，数字线索弱或仅顺带出现，判非数字更合理。
1,3,37801.0,Enjoy the peaceful weather at home,"I'm at home, basking in the serene sunlight that filters through the window, feeling a mix of mild anxiety about life's uncertainties and a profound contentment, knowing the world is largely at peace and safe.",non_digital_or_incidental,low,none,,anxiety,,以线下行为为主，数字线索弱或仅顺带出现，判非数字更合理。
2,3,37801.0,Enjoy the meal at home,"I'm settling into the serene comfort of my home, feeling a sense of peace after a day of mundane tasks and quiet contemplation. Despite the sunny weather outside, there's a warmth inside that's soothing, as I anticipate a simple yet satisfying meal at home.",non_digital_or_incidental,low,none,,,,以线下行为为主，数字线索弱或仅顺带出现，判非数字更合理。
3,3,37801.0,Write down thoughts or feelings in a diary to further reflection,"I am sitting in the comfort of my modest home, the sunlight streaming through the window, as I carefully jot down my thoughts in my diary, the quiet of the sunny afternoon allowing me to find solace and peace amidst the sadness that occasionally visits me.",non_digital_or_incidental,low,none,,,,以线下行为为主，数字线索弱或仅顺带出现，判非数字更合理。
4,3,37801.0,Set the alarm for a comfortable wake-up time,"I am settling into a quiet evening at home, feeling a sense of relief that the day has been peaceful, and I'm preparing for a restful night, appreciating the simplicity and tranquility of my retirement life.",non_digital_or_incidental,low,none,,,,以线下行为为主，数字线索弱或仅顺带出现，判非数字更合理。
