agent_id,day,t,action,status_text_clean,review_label,review_confidence,scenario_guess,scenario_hit_evidence,friction_evidence,incidental_evidence,scene_analysis_zh
5,4,72001.0,Serve the meal on a plate,"I'm enjoying a quiet evening at home, setting the table with a plate for my meal, my mind reflecting on the day's tranquility and the warmth of the simple moments that have filled it.",non_digital_or_incidental,low,none,,,,以线下行为为主，数字线索弱或仅顺带出现，判非数字更合理。
6,4,72001.0,Return home after shopping,"I've just finished my grocery shopping, feeling a sense of satisfaction as I head home. The day was quiet, and while there were moments of joy and a touch of fear, I'm content with the simple pleasures of the day.",non_digital_or_incidental,low,none,,fear,,以线下行为为主，数字线索弱或仅顺带出现，判非数字更合理。
1,4,73801.0,Review any discounts or offers available at the shopping location,"I'm taking a leisurely stroll through the park, my pace slow due to the fading sunlight, as I enjoy the calmness of the day and contemplate the simplicity of life, feeling a sense of contentment and peace despite my anxiety about the unknown.",non_digital_or_incidental,low,none,,anxiety,,以线下行为为主，数字线索弱或仅顺带出现，判非数字更合理。
2,4,73801.0,Begin the winding down process,"I'm wrapping up my day, feeling a sense of contentment after a peaceful day with no pressing issues. The sun is shining, and despite the slight unease with modern tech, I'm grateful for the simple joys of home and family.",non_digital_or_incidental,low,none,,,,以线下行为为主，数字线索弱或仅顺带出现，判非数字更合理。
3,4,73801.0,Prepare the kitchen,"As the sun sets and the air cools to a comfortable 23C, I'm gently preparing the kitchen, my hands steady and familiar. Even as tranquility wraps around me, the lingering sadness in my heart finds solace in the small rituals of daily life, each task a reminder of the quiet strength in simplicity.",non_digital_or_incidental,low,none,,,,以线下行为为主，数字线索弱或仅顺带出现，判非数字更合理。
4,4,73801.0,Enjoy the meal at home,"I'm relaxing at home after a peaceful day, savoring a simple meal with a mix of contentment and gratitude for the tranquility, even though the day was devoid of grand incidents.",non_digital_or_incidental,low,none,,,,以线下行为为主，数字线索弱或仅顺带出现，判非数字更合理。
5,4,73801.0,Eat the meal,"I'm relaxing at home, the sun outside casts a warm glow through my window, and though I feel a bit nostalgic for the simpler days, a quiet sense of contentment wraps around me as I prepare to eat a meal.",non_digital_or_incidental,low,none,,,,以线下行为为主，数字线索弱或仅顺带出现，判非数字更合理。
6,4,73801.0,Review shopping list,"I'm sitting comfortably at home, my eyes scanning my shopping list with a contented smile, reflecting on the peaceful day I've had, even if it was devoid of excitement.",non_digital_or_incidental,low,none,,,,以线下行为为主，数字线索弱或仅顺带出现，判非数字更合理。
1,4,75601.0,Travel to the shopping location,"I'm heading out to do some shopping, my heart light from the serene day's end. Even though I'm a bit anxious about navigating the bustling stores, I find a comforting sense of peace knowing that each quiet day is a gift worth appreciating.",non_digital_or_incidental,low,none,,anxious,,以线下行为为主，数字线索弱或仅顺带出现，判非数字更合理。
2,4,75601.0,Lie down in the bed,"As I sit in my cozy home at this hour, the sun's warm glow fading, I find myself content and at peace, ready to rest after a day that brought no major surprises, just the comfort of calmness.",non_digital_or_incidental,low,none,,,,以线下行为为主，数字线索弱或仅顺带出现，判非数字更合理。
3,4,75601.0,Cook the meal,"I am sitting at home, feeling a sense of calm and contentment after a peaceful day, my heart lightened by the quiet moments of reflection. As I prepare dinner, I take solace in the simple routine and the memories of my husband that occasionally bring a smile to my face.",non_digital_or_incidental,low,none,,,,以线下行为为主，数字线索弱或仅顺带出现，判非数字更合理。
4,4,75601.0,Clean up the dining area after eating,"As I enjoy the gentle warmth of the evening sun and the serene quiet of a peaceful day, I find myself cleaning up the dining area with a steady hand, my attention focused on the simplicity and efficiency of my task, reflecting on the tranquility of this stress-free evening.",non_digital_or_incidental,low,none,,stress,,以线下行为为主，数字线索弱或仅顺带出现，判非数字更合理。
5,4,75601.0,Wash the utensils used for cooking and eating,"Feeling a sense of contentment, I wash the dishes after a day of quiet introspection. Despite the sun's warmth outside, I'm glad for the simplicity of my evening.",non_digital_or_incidental,low,none,,,,以线下行为为主，数字线索弱或仅顺带出现，判非数字更合理。
1,4,77401.0,Purchase the listed items,"I'm at home, enjoying the serene calm of a sunny evening, as I prepare to shop for some essentials, my anxiety tempered by the comforting familiarity of this tranquil time.",non_digital_or_incidental,low,none,,anxiety,,以线下行为为主，数字线索弱或仅顺带出现，判非数字更合理。
2,4,77401.0,Close the bedroom door,"In the quiet comfort of my home, I'm ready to close my bedroom door, content with the day's tranquility and the sense of ease that comes with the simple satisfaction of routine.",non_digital_or_incidental,low,none,,,,以线下行为为主，数字线索弱或仅顺带出现，判非数字更合理。
3,4,77401.0,Cook the meal,"As I sit in the quiet of my home, the warmth of the sun still lingers outside, I am contentedly preparing a meal, a simple comfort that fills me with a small but meaningful joy, as I reflect on the tranquility of the day and memories of my late husband.",non_digital_or_incidental,low,none,,,,以线下行为为主，数字线索弱或仅顺带出现，判非数字更合理。
4,4,77401.0,Prepare for sleep by turning off electronic devices,"I am sitting comfortably in my living room, the warm evening sun casting a gentle glow, as I prepare to unwind after a tranquil day. I feel a sense of satisfaction from a day of simplicity and peace, turning off my devices to settle into a restful night.",non_digital_or_incidental,low,none,,,,以线下行为为主，数字线索弱或仅顺带出现，判非数字更合理。
5,4,77401.0,Relax in a comfortable chair,"I'm settled in my living room, the sun sets gently outside, and I'm contemplating the day's quiet moments, feeling a sense of contentment after a day of introspection and reflection, though there's a subtle touch of melancholy in the air.",non_digital_or_incidental,low,none,,,,以线下行为为主，数字线索弱或仅顺带出现，判非数字更合理。
6,4,77401.0,Set the room temperature to 23C for a comfortable sleep,"After a long day of exploring new tech features and advising my neighbors on digital safety, I'm now settled at home, satisfied with the quiet simplicity of the evening, as I set the room temperature just right for a restful night's sleep.",non_digital_or_incidental,low,none,,,,以线下行为为主，数字线索弱或仅顺带出现，判非数字更合理。
1,4,79201.0,Purchase the listed items,"As I walk through the peaceful, sunny evening, my mind remains tranquil, despite the quiet unease that often lingers in the back of my mind. I'm feeling content with the simple, calm day and am now looking forward to a shopping trip to enjoy some peace and safety.",non_digital_or_incidental,low,none,,,,以线下行为为主，数字线索弱或仅顺带出现，判非数字更合理。
2,4,79201.0,Prepare a simple meal considering the temperature,"I'm at home, the sun is setting outside, and I'm contemplating a simple, soothing meal to enjoy as the day winds down. The quiet of the evening and the warmth of the 23-degree temperature are a welcome contrast to the digital frustrations I've faced today.",non_digital_or_incidental,low,none,,frustrations,,以线下行为为主，数字线索弱或仅顺带出现，判非数字更合理。
3,4,79201.0,Set the table,"I'm at home, setting the table for dinner, my hands steady despite the twilight making small print difficult to read. My heart is calm, a gentle sadness punctuated by moments of warmth, as I prepare to savor the quiet of the evening.",non_digital_or_incidental,low,none,,difficult,,以线下行为为主，数字线索弱或仅顺带出现，判非数字更合理。
4,4,79201.0,Ensure the room is comfortable and set the temperature to 23C,"I've settled into my evening routine, ensuring my room is comfortably set at 23C, reflecting on a day that felt peaceful and simple, filled with a contentment that stems from the absence of stress and major incidents.",non_digital_or_incidental,low,none,,stress,,以线下行为为主，数字线索弱或仅顺带出现，判非数字更合理。
5,4,79201.0,Prepare the bedroom for sleep,"As I prepare for bed, the warm, sunny evening offers a peaceful respite from the day's quiet melancholy, and I feel a sense of gratitude for the simple joys of life, looking forward to tomorrow with a hopeful heart.",non_digital_or_incidental,low,none,,,,以线下行为为主，数字线索弱或仅顺带出现，判非数字更合理。
6,4,79201.0,Adjust the room lighting to a dim setting for sleep,"As I sit in my living room with the evening sun casting a warm glow, I gently lower the room's lights to a comfortable dimness, content with the quiet day and reflecting on the blend of emotions that have filled it, from the simple joy of a peaceful day to a touch of disappointment at the lack of excitement.",non_digital_or_incidental,low,none,,,,以线下行为为主，数字线索弱或仅顺带出现，判非数字更合理。
1,4,81001.0,Begin preparing the dinner ingredients,"As I sit in my modest home at this peaceful hour, I start gathering dinner ingredients, my mind a gentle swirl of tranquility and a cautious appreciation for the day's serene calm, knowing that simplicity is my comfort in this uncertain world.",non_digital_or_incidental,low,none,,,,以线下行为为主，数字线索弱或仅顺带出现，判非数字更合理。
2,4,81001.0,Serve the meal at the dining table,"I'm at home, the sun sets warmly outside as I prepare a meal, my mood is serene, feeling grateful for the quiet day without complications.",non_digital_or_incidental,low,none,,,,以线下行为为主，数字线索弱或仅顺带出现，判非数字更合理。
3,4,81001.0,Enjoy the meal,"As I sit at home in the comfort of my familiar surroundings, the soft glow of the sunlight filtering through the window, I'm feeling a quiet contentment from a simple meal, my mind softly dwelling on the tranquility of the day and the cherished memories of my husband.",non_digital_or_incidental,low,none,,,,以线下行为为主，数字线索弱或仅顺带出现，判非数字更合理。
4,4,81001.0,Change into comfortable sleepwear,"I've just finished my daily routine, feeling a serene sense of peace after a tranquil day. I'm now in my home, changing into comfortable sleepwear, reflecting on the day's simplicity and gratitude for its lack of stress.",non_digital_or_incidental,low,none,,stress,,以线下行为为主，数字线索弱或仅顺带出现，判非数字更合理。
5,4,81001.0,Adjust room temperature to 23C,"As the sun sets, I'm sitting in my quiet home, feeling a mix of calm and a bit of melancholy. The day was peaceful, with its moments of introspection and the satisfaction of appreciating the simple joys, yet the solitude makes me long for the warmth of family and community.",non_digital_or_incidental,low,none,,,,以线下行为为主，数字线索弱或仅顺带出现，判非数字更合理。
1,4,82801.0,Preheat the oven to the appropriate temperature,"Tonight, I'm in my quiet, sunny home, preparing to eat at home—my simple yet cherished routine. The tranquil peace of the evening wraps around me like a cozy blanket, a comforting reprieve from the unpredictability of life.",non_digital_or_incidental,low,none,,,,以线下行为为主，数字线索弱或仅顺带出现，判非数字更合理。
2,4,82801.0,Enjoy the meal in a relaxed manner,"I'm enjoying a peaceful meal at home, the sun setting outside, feeling a sense of relief from the day's calm routine.",non_digital_or_incidental,low,none,,,,以线下行为为主，数字线索弱或仅顺带出现，判非数字更合理。
3,4,82801.0,Prepare the sleeping environment,"As the sun sets and the temperature gently cools, I sit in the quiet of my home, preparing for a peaceful night. Despite the tranquility of the evening, the gentle ache of solitude occasionally stirs, but I find comfort in the familiar routine and the simple pleasure of winding down for sleep.",non_digital_or_incidental,low,none,,,,以线下行为为主，数字线索弱或仅顺带出现，判非数字更合理。
4,4,82801.0,Perform a brief relaxation exercise,"I'm enjoying a quiet evening, having just wrapped up some simple online tasks with a sense of satisfaction, now feeling a calmness in the serene night air.",non_digital_or_incidental,low,none,,,,以线下行为为主，数字线索弱或仅顺带出现，判非数字更合理。
5,4,82801.0,Engage in light reading to relax,"As the sun sets and the temperature cools to a comfortable 23C, I find myself settled at home, turning to the comforting pages of a book, the quiet evening echoing the simplicity I've been reflecting on today.",non_digital_or_incidental,low,none,,,,以线下行为为主，数字线索弱或仅顺带出现，判非数字更合理。
6,4,82801.0,Take a deep breath and focus on relaxation techniques,"I'm enjoying the serene tranquility of a sunny evening, sipping tea as I leisurely navigate the quiet house, my mind reflecting on the day's calm moments and the gentle fears that accompany them.",non_digital_or_incidental,low,none,,,,以线下行为为主，数字线索弱或仅顺带出现，判非数字更合理。
1,4,84601.0,Start cooking the main course in the oven,"I'm preparing a dinner at home, carefully navigating the oven as the calm of the evening sets in, and despite my usual wariness with technology, I feel a sense of contentment amidst the quietude and the simplicity of my tasks.",non_digital_or_incidental,low,none,,,,以线下行为为主，数字线索弱或仅顺带出现，判非数字更合理。
2,4,84601.0,Enjoy the meal in a relaxed manner,"As I sit in the comfortable quiet of my home at this hour, the sun still brightens my space, and I feel a profound sense of relief wash over me, reflecting on the tranquil flow of the day with no disturbances, and I plan to enjoy a peaceful meal with the warmth of solitude.",non_digital_or_incidental,low,none,,,,以线下行为为主，数字线索弱或仅顺带出现，判非数字更合理。
3,4,84601.0,Relax in a comfortable position,"As the sun sets, I settle into a cozy armchair in my living room, feeling a serene satisfaction from a day spent in peace and quiet, savoring the gentle warmth of the room and the quiet joy of recollecting memories of my late husband, even amidst the quiet sadness that lingers.",non_digital_or_incidental,low,none,,,,以线下行为为主，数字线索弱或仅顺带出现，判非数字更合理。
4,4,84601.0,Lie down in bed and start the process of winding down,"It's now 11:30 PM, and I've just put my phone away, feeling a bit of anxiety as I check the lights in the room. With the night's serene warmth and the sun's glow still visible, I find myself settled on the bed, reflecting on the day's quiet simplicity and hoping for a peaceful night's sleep.",non_digital_or_incidental,low,none,,anxiety,,以线下行为为主，数字线索弱或仅顺带出现，判非数字更合理。
5,4,84601.0,Gently brush teeth and wash face,"It's a tranquil evening, with the sun casting a warm glow as I gently brush my teeth and wash my face, feeling a quiet contentment after a day that, while uneventful, filled me with a profound sense of gratitude and peace.",non_digital_or_incidental,low,none,,,,以线下行为为主，数字线索弱或仅顺带出现，判非数字更合理。
6,4,84601.0,Lay down and close your eyes to initiate sleep,"I'm settled in my cozy home, contentedly winding down after a day that, though quiet, was filled with both the comforting familiar and the subtle stirrings of everyday anxieties. Now, I'm ready to lay down and drift off into sleep with a sense of gentle satisfaction.",non_digital_or_incidental,low,none,,,,以线下行为为主，数字线索弱或仅顺带出现，判非数字更合理。
1,5,1.0,Start cooking the main course in the oven,"Today, in this tranquil, sunny weather, I'm in the comfort of my home, starting to prepare the main course in the oven. The calm of the day, despite my natural caution, brings a serene satisfaction, as I appreciate the simplicity of my actions and the peacefulness that envelops me.",non_digital_or_incidental,low,none,,,,以线下行为为主，数字线索弱或仅顺带出现，判非数字更合理。
2,5,1.0,Clean up the dishes after eating,"I've finished my meal at home, the dishes are waiting to be cleaned, and I feel a sense of relief that the day has been calm and uneventful, with a touch of contentment in the warmth of the sunny weather.",non_digital_or_incidental,low,none,,,,以线下行为为主，数字线索弱或仅顺带出现，判非数字更合理。
3,5,1.0,Close the curtains to ensure a dark environment,"At 74, sitting in the quiet solitude of my darkened room on this sun-drenched evening, I find solace in the silence and the comforting presence of shadows, as the gentle warmth of the 23C night wraps around me, bringing peace and a touch of nostalgia for the simpler joys of life.",non_digital_or_incidental,low,none,,,,以线下行为为主，数字线索弱或仅顺带出现，判非数字更合理。
4,5,1.0,Close the bedroom door to ensure a quiet environment,"As the sun dips below the horizon, I find myself closing the bedroom door behind me, savoring the quiet and comfort of the simplicity I value. My thoughts drift to the peaceful day I've had, feeling content in the absence of any major stressors.",non_digital_or_incidental,low,none,,,,以线下行为为主，数字线索弱或仅顺带出现，判非数字更合理。
5,5,1.0,Lie down in bed and close the curtains,"I'm nestled in my comfortable bed at the start of a peaceful, sunny day, feeling a quiet contentment from the uneventful moments of yesterday. As the curtains gently block out the morning light, I'm already looking forward to a restful sleep.",non_digital_or_incidental,low,none,,,,以线下行为为主，数字线索弱或仅顺带出现，判非数字更合理。
6,5,1.0,Prepare a meal,"As I sit comfortably in my living room, a warm 23 degrees Celsius temperature wraps around me, I feel a sense of satisfaction from a day that's been peaceful, filled with the simple joy of preparing a meal at home, all while reflecting on the quiet beauty of life's smaller moments.",non_digital_or_incidental,low,none,,,,以线下行为为主，数字线索弱或仅顺带出现，判非数字更合理。
1,5,1801.0,Prepare a side dish suitable for the main course,"I'm at home, preparing a side dish for dinner. Despite the sunny weather and tranquil day, there's an underlying anxiety that keeps me anchored to the familiar tasks, knowing that life's quiet moments are as precious as they are fleeting.",non_digital_or_incidental,low,none,,anxiety,,以线下行为为主，数字线索弱或仅顺带出现，判非数字更合理。
2,5,1801.0,Reflect on the day's experiences while eating,"After a peaceful day, I'm enjoying a home-cooked meal, feeling a sense of relief as I reflect on the tranquility of the day, though a bit exasperated by the frequent and often confusing digital interactions I've encountered.",non_digital_or_incidental,low,none,,confusing,,以线下行为为主，数字线索弱或仅顺带出现，判非数字更合理。
3,5,1801.0,Set the alarm for morning if needed,"In the tranquility of my modest home, I'm taking a moment to rest and reflect amidst the serene sunlight. Despite my ongoing melancholy, the simple comfort of these quiet moments soothes my soul and allows a sense of satisfaction to seep in.",non_digital_or_incidental,low,none,,,,以线下行为为主，数字线索弱或仅顺带出现，判非数字更合理。
4,5,1801.0,Check if there are any urgent digital tasks to complete,"I'm at home, the sun is shining, and I'm currently sifting through my apps to ensure all digital tasks are in order, feeling a sense of contentment in the tranquility of the day.",non_digital_or_incidental,low,none,,,,以线下行为为主，数字线索弱或仅顺带出现，判非数字更合理。
5,5,1801.0,Prepare the sleeping environment,"As I prepare for sleep in the warm glow of the sun's setting, I feel a sense of contentment mixed with the gentle stir of introspection from a quiet day filled with moments of reflection.",non_digital_or_incidental,low,none,,,,以线下行为为主，数字线索弱或仅顺带出现，判非数字更合理。
6,5,1801.0,Sit down and enjoy the meal,"I am comfortably seated at home, relishing the serene evening with a satisfying meal, feeling content and at peace in the quiet and sunlit room.",non_digital_or_incidental,low,none,,,,以线下行为为主，数字线索弱或仅顺带出现，判非数字更合理。
1,5,3601.0,Set the table with plates and cutlery,"Today, as I set the table with plates and cutlery, the tranquil feeling of the sunny day and the cool 23°C temperature envelop me in a calm that feels almost luxurious. My mind is at ease, reflecting on the simple joys of life despite the lingering anxiety about the unpredictable aspects of the future.",non_digital_or_incidental,low,none,,anxiety,,以线下行为为主，数字线索弱或仅顺带出现，判非数字更合理。
2,5,3601.0,Relax in your favorite chair with a book or TV,"I'm sitting comfortably in my favorite chair, the quiet hum of the city outside as the sun dips low. The relief of a day with no complications washes over me, a feeling of peace and satisfaction in the simple pleasure of reading a good book.",non_digital_or_incidental,low,none,,,,以线下行为为主，数字线索弱或仅顺带出现，判非数字更合理。
3,5,3601.0,Engage in a calming activity like reading or meditation,"I am settling into a tranquil evening at home, my thoughts softly drifting between the comfort of silence and the cherished memories of my husband. The gentle warmth of the sun outside seems to seep through the curtains, enveloping me in a peaceful, restorative state of mind.",non_digital_or_incidental,low,none,,,,以线下行为为主，数字线索弱或仅顺带出现，判非数字更合理。
5,5,3601.0,Lie down in bed,"As the sun sets in this tranquil night, I find myself at home, my heart both heavy with thoughts of days gone by and yet hopeful for tomorrow, with nothing but a soft bed awaiting me in the quiet solitude of my peaceful abode.",non_digital_or_incidental,low,none,,,,以线下行为为主，数字线索弱或仅顺带出现，判非数字更合理。
6,5,3601.0,Wash the dishes after eating,"As I finish dinner at home, my hands沾满了油渍，但我的心情却是满足的。在这宁静的夜晚，我享受着简单的喜悦，尽管一天过得平淡无奇，但内心却有一种难得的平静。",non_digital_or_incidental,low,none,,,,以线下行为为主，数字线索弱或仅顺带出现，判非数字更合理。
1,5,5401.0,Serve the meal once everything is ready,"I am enjoying a peaceful afternoon stroll in the park, basking in the sunny weather and the serene atmosphere that brings me a rare sense of tranquility, even as the persistent anxiety about life's uncertainties lingers in the background.",non_digital_or_incidental,low,none,,anxiety,,以线下行为为主，数字线索弱或仅顺带出现，判非数字更合理。
2,5,5401.0,Prepare the sleeping environment,"Relieved that today's events were uneventful, I take a moment to appreciate the quietude of the sunny evening, and with a sense of contentment, I set about arranging my sleeping environment in preparation for a restful night.",non_digital_or_incidental,low,none,,,,以线下行为为主，数字线索弱或仅顺带出现，判非数字更合理。
3,5,5401.0,Lie down and drift off to sleep,"I am lying in my comfortable home, the gentle warmth of the sun filtering through the windows, and a serene calmness washes over me as I attempt to rest. The quietude of the day, filled with simple joys and memories of my husband, brings a gentle peace that soothes the occasional sadness in my heart.",non_digital_or_incidental,low,none,,,,以线下行为为主，数字线索弱或仅顺带出现，判非数字更合理。
4,5,5401.0,Consider reading a book or listening to soothing music,"I find myself comfortably settled at home, feeling a blend of tranquility and contentment after a day of simplicity and peace. The warm sun outside pairs nicely with the quiet, and I'm contemplating a leisurely read or some soothing music to wind down.",non_digital_or_incidental,low,none,,,,以线下行为为主，数字线索弱或仅顺带出现，判非数字更合理。
