intention,action,agent_status_status,emitted,outcome,step_intention,action_snapshot_day,action_snapshot_t,join_mode,join_lag_seconds
Check the shopping list,Dress appropriately for the weather,"I'm enjoying the serene morning sunshine, feeling a sense of relief that nothing's amiss, as I prepare to go shopping, mindful of the pleasant weather.",1,positive,Check the shopping list,0,25201.0,same_t,0.0
Read a book or magazine,Read a book or magazine,"As I sit comfortably in my living room, the sun shining through the window brings a sense of warmth and calm to my otherwise anxious mind. I'm feeling a little relief from the day's quiet routine, lost in the pages of a good book, grateful for the simple pleasure of reading.",1,positive,Read a book or magazine,0,28801.0,same_t,0.0
Plan shopping list based on inventory and needs,Start the day at home,"At the beginning of a peaceful sunny day, I sit comfortably at home, my hands skillfully navigating the simplicity of my apps to ensure the day's routines run smoothly, a feeling of relief washing over me as I trust the straightforward interface and my account's safety is well-protected.",0,no_event,Plan shopping list based on inventory and needs,0,28801.0,same_t,0.0
Prepare a light breakfast,Engage in morning meditation or quiet reflection,"Right now, I'm sitting comfortably at home, the sun shining through the windows, my mind focused on starting my morning meditation, feeling a gentle balance of calmness and contentment.",1,positive,Prepare a light breakfast,0,28801.0,same_t,0.0
Decide on shopping list based on needs,Prepare kitchen for cooking,"I'm in the comfort of my home, the sun shining warmly, and I'm feeling a sense of relief as I prepare the kitchen for cooking dinner, ready to enjoy a meal at home. Today, there's nothing particularly noteworthy to ponder, just the simple pleasure of a routine moment.",0,no_event,Decide on shopping list based on needs,0,28801.0,same_t,0.0
Leave home,Prepare the kitchen for cooking,"As I step into the kitchen, the sun's warm rays filter through the window, and I feel a sense of relief knowing I can cook without the usual frustration from navigating digital complexities. My mind is at peace, simply focusing on preparing the day's meal.",0,no_event,Leave home,0,32401.0,same_t,0.0
Read a book or magazine,Prepare a light breakfast,"I am sitting comfortably in my small living room, basking in the morning sunlight, feeling a sense of relief as I prepare a light breakfast without any unsettling digital interruptions, and I'm content that nothing out of the ordinary is occurring today.",1,positive,Read a book or magazine,0,32401.0,same_t,0.0
Start the day at home,Prepare a meal considering the weather and temperature,"I am at home, feeling a sense of relief as the sun casts a warm glow, and I prepare a meal, my thoughts focused on the simple and clear process to keep me at ease.",1,positive,Start the day at home,0,32401.0,same_t,0.0
Engage in morning meditation or quiet reflection,Check phone contacts,"I'm enjoying a leisurely morning, my phone in hand, as I navigate through my contact list, feeling content as the sun shines warmly through my window.",0,no_event,Engage in morning meditation or quiet reflection,0,32401.0,same_t,0.0
Prepare a light breakfast,Check if ingredients for a meal are available,"As I stand in my sunny, 23-degree living room, a sense of relief washes over me knowing nothing out of the ordinary is happening. With a calm and thoughtful demeanor, I take a moment to check my pantry, ensuring I have everything I need for my simple meal at home today.",0,no_event,Prepare a light breakfast,0,36001.0,same_t,0.0
Check phone contacts,Select a friend to call,"I'm currently sipping my tea under the warm sun, feeling content as I mull over my plans to reach out to a friend today, and my thoughts are at peace with nothing weighing on me.",0,no_event,Check phone contacts,0,36001.0,same_t,0.0
Select a friend to call,Prepare a home-cooked meal,"I am in the comfort of my home, the sun streaming in, feeling at ease as I prepare a warm, home-cooked meal, which is both satisfying and familiar, and I'm enjoying the quiet moment to myself.",0,no_event,Select a friend to call,0,39601.0,same_t,0.0
Rest or engage in leisure activities post-meal,Rest or engage in leisure activities post-meal,"I've just settled into a quiet corner of the park, enjoying the warmth of the sun and the tranquility of the surroundings. Today, I feel a sense of relief that no urgent issues are on my mind, and my thoughts are free of any particular worries.",0,no_event,Rest or engage in leisure activities post-meal,0,50401.0,same_t,0.0
Relax or engage in leisure activities after eating,Prepare the sleeping environment,"As I navigate the bright afternoon sun at home, I'm feeling a sense of relief, eager to set up my sleeping nook and unwind in the quiet of my cozy living space.",0,no_event,Relax or engage in leisure activities after eating,0,50401.0,same_t,0.0
Rest or engage in leisure activities post-meal,Prepare a comfortable sleep environment,"I'm winding down after a leisurely afternoon at the park, the sun is shining warmly, and I feel a sense of relief as I prepare to retire to the comfort of my home for a restful night. Today, nothing out of the ordinary has happened, and I'm just enjoying the quiet peace of a sunny evening.",0,no_event,Rest or engage in leisure activities post-meal,0,54001.0,same_t,0.0
Prepare for sleep by setting a comfortable environment,Ensure all electronic devices are turned off or on silent mode,"I've just arrived home from the park, feeling content and relaxed, as the warm sun sets, casting a serene glow over my small apartment. My body aches slightly from the walk, but I'm content with the day's simple pleasures.",0,no_event,Prepare for sleep by setting a comfortable environment,0,64801.0,same_t,0.0
Prepare for sleep by setting a comfortable environment,Engage in relaxing activities to ease into sleep,"I'm winding down my day at home, feeling content with the sun shining through my window. My body feels relaxed, eager to engage in something simple before drifting into sleep.",1,positive,Prepare for sleep by setting a comfortable environment,0,64801.0,same_t,0.0
Enjoy the meal alone or possibly with a companion,Prepare a comfortable sleep environment,"As I prepare for sleep in my comfortable home, I'm focused on ensuring my online accounts are secure, changing passwords and activating dual authentication, though I can't shake the unease that comes with ""risk alerts"" and payment failures. The evening is sunny, and the temperature is just right at 23C, making for a peaceful atmosphere as I take care of my routine before bed.",0,no_event,Enjoy the meal alone or possibly with a companion,0,82801.0,same_t,0.0
Go to the bedroom and lie down,Close your eyes and focus on relaxing your body,"I'm at home, enjoying the peaceful quiet of a sunlit evening, feeling a sense of calm and hope as I sit quietly, my body relaxed, my mind at ease.",0,no_event,Go to the bedroom and lie down,1,1.0,same_t,0.0
Sit down at the dining table,Enjoy the meal,"As I sit at home, enjoying the warmth of the sunny weather with a cup of tea, I'm feeling a gentle relief, content to savor the simple pleasure of a quiet evening after a day of routine tasks.",0,no_event,Sit down at the dining table,1,3601.0,same_t,0.0
Return to a comfortable and familiar environment,Access existing food or prepare a meal,"At 2 AM, I'm at home, the sun is shining outside, and I'm feeling a mix of satisfaction and relief, sipping a cup of tea, my curiosity piqued by the latest tech notification, yet also wary of the potential pitfalls.",0,no_event,Return to a comfortable and familiar environment,1,7201.0,same_t,0.0
Enjoy a meal in a relaxing setting,Assess current needs and preferences,"As the sun shines brightly outside, I'm lounging in my comfortable home, the warmth of the day seeping through the windows, my mind gently pondering over my day's plans. The mix of emotions is a gentle ebb and flow, carrying me through a day that seems as tranquil as the river I often think about.",0,no_event,Enjoy a meal in a relaxing setting,1,14401.0,same_t,0.0
Plan shopping list based on needs,Ensure all necessary ingredients are at home,"I am relaxing at home with the sun shining brightly outside, feeling a serene blend of contentment and a cautious optimism, as I double-check my pantry, ensuring all ingredients are in place for a satisfying home-cooked meal.",0,no_event,Plan shopping list based on needs,1,21601.0,same_t,0.0
Set the alarm or reminder for an appropriate sleep time if needed,Lie down in bed,"I am comfortably lying down in my cozy home, basking in the warm sunlight filtering through my window, feeling a gentle wave of relief as I reflect on the tranquil and simple days of my retirement.",0,no_event,Set the alarm or reminder for an appropriate sleep time if needed,1,54001.0,same_t,0.0
Enjoy the meal in a comfortable setting,Clean up after the meal,"I'm sitting comfortably at home, enjoying the peaceful evening as I anticipate the end of a satisfying meal. The tranquil weather outside complements the calmness within, leaving me with a feeling of relief.",0,no_event,Enjoy the meal in a comfortable setting,1,79201.0,same_t,0.0
Serve the meal in a comfortable and enjoyable setting,Enjoy the meal alone or with a family member if possible,"monologue:

As I sit comfortably at home, enjoying the warmth of the 23 degrees sunny evening, I'm feeling a mix of relief and contentment. The quiet routine of the day is bringing me a sense of peace, and while there's nothing particularly exciting happening, the simple joy of a home-cooked meal brings a smile to my face.",0,no_event,Serve the meal in a comfortable and enjoyable setting,1,79201.0,same_t,0.0
Enjoy the meal alone or with a family member if possible,Ensure leftovers are stored properly for another meal if necessary,"I'm home, winding down from the day, feeling a sense of relief in the quiet simplicity of the sunny evening. I'm contemplating how to store leftovers properly, a task I approach with careful thought, balancing the joy of a satisfying meal with the cautious edge of my personality.",1,positive,Enjoy the meal alone or with a family member if possible,1,82801.0,same_t,0.0
Plan a suitable time to visit a nearby store,Assess home comfort,"I'm nestled comfortably at home, the sun casting a warm glow, as I enjoy the quiet solitude of a peaceful evening, my mind at ease from the simple satisfaction of a tranquil day.",0,no_event,Plan a suitable time to visit a nearby store,2,10801.0,same_t,0.0
Return to the comfort of home,Check available ingredients and plan the meal,"As I sit in my cozy home at this serene hour, the sun casting a warm glow through the window, I feel a quiet satisfaction. My hands move gently over the familiar kitchen surfaces, a mix of fear and contentment in my heart as I contemplate today's simple meal, a comforting reprieve from the complexities that once overwhelmed me.",0,no_event,Return to the comfort of home,2,14401.0,same_t,0.0
Return to home if not already there,Prepare a meal at home,"As I sit in my cozy home, the sun streaming in, I feel a blend of peace and a hint of longing. My day has been calm and quiet, a stark contrast to the hustle and bustle of my former work life, as I prepare a meal for my loved ones, appreciating the simplicity and serenity of the moment.",1,positive,Return to home if not already there,2,18001.0,same_t,0.0
Retire to the bedroom,Practice deep breathing to induce sleep,"At 6:00 AM, as the sun rises warmly, I sit comfortably in my home, feeling a serene contentment settle over me. The tranquility of the morning is a welcome break from the day's hustle, and I find myself gently practicing deep breathing to guide myself towards the peacefulness of sleep.",0,no_event,Retire to the bedroom,2,21601.0,same_t,0.0
Enjoy the meal in a comfortable setting,Ensure leftovers are stored properly for future use,"Today, as the sun bathes the city in golden warmth, I'm contentedly preparing to savor the leftovers I've meticulously stored, a routine that brings me a rare peace, for it's in these simple tasks that I find my tranquility.",1,positive,Enjoy the meal in a comfortable setting,2,50401.0,same_t,0.0
Review shopping list based on daily needs,Plan the most convenient route from home considering distance and traffic,"I'm winding down for the evening, considering my shopping list in a sunny 23-degree evening, my mind focused on plotting the simplest, most efficient path from home.",1,positive,Review shopping list based on daily needs,2,68401.0,same_t,0.0
Plan the most convenient route from home considering distance and traffic,"Dress appropriately for the weather, which is sunny","Today, as the sun sets, I'm contently preparing for a brief stroll to the market, my mood at ease, relishing the simplicity of a peaceful routine.",0,no_event,Plan the most convenient route from home considering distance and traffic,2,72001.0,same_t,0.0
Leave home to begin the shopping trip,Visit the nearest shopping center or grocery store,"I'm taking a leisurely stroll through the sunlit evening, feeling content with the simple routine of the day, as I ponder the prospect of a visit to the local shopping center, enjoying the tranquility that the serene weather brings.",1,positive,Leave home to begin the shopping trip,2,79201.0,same_t,0.0
Visit the nearest shopping center or grocery store,Make purchases from the shopping list,"I've just returned from a peaceful walk, the sun shining warmly as I meander through the neighborhood. Today feels like a quiet success, as I've managed to cross off several items from my shopping list without the hassle of dealing with those pesky online forms or pop-up ads.",0,no_event,Visit the nearest shopping center or grocery store,2,82801.0,same_t,0.0
Make purchases from the shopping list,Check the home environment for any necessary maintenance or tasks,"As I sit in the familiar comfort of my home, I'm feeling a serene contentment. My day starts with a simple task of ensuring everything is in order; the sun's gentle warmth is a reminder that it's another peaceful morning I can appreciate.",0,no_event,Make purchases from the shopping list,3,1.0,same_t,0.0
Identify nearest shopping center or convenience store,Check current contact information,"I'm relaxing at home, the sun shining outside makes me feel quite content. I'm currently going through my contact list, ensuring I have everyone's information up-to-date, and it feels satisfying to organize these little bits of life.",1,positive,Identify nearest shopping center or convenience store,3,1.0,same_t,0.0
Check current contact information,Call a friend,"At this moment, I'm enjoying the tranquility of a sunny evening, contemplating the day's simple joys from the comfort of my home, eager to reach out and connect with a friend over a call.",0,no_event,Check current contact information,3,3601.0,same_t,0.0
Stay at home as no movement is necessary,"Prepare a meal with ease, considering the late hour and the calm environment","I'm settled at home in the quiet hour of early morning, the sun outside painting a serene picture, as I prepare a meal with a sense of contentment, balancing the fear of online transactions with the peace of a peaceful day and the simple joy of homemade comfort.",0,no_event,Stay at home as no movement is necessary,3,7201.0,same_t,0.0
Call a friend,Pick up phone to call friends,"I'm sitting comfortably in my living room, the sun casting a warm glow through the window, and I'm about to make a call to friends, feeling content with the simplicity and peace of this uneventful evening.",0,no_event,Call a friend,3,7201.0,same_t,0.0
Pick up phone to call friends,Prepare a meal based on available ingredients,"As I sit in my cozy home office, the quiet hum of the sunlit afternoon is a soothing backdrop to my thoughts. I'm carefully considering the meal I'll prepare tonight, a task that feels both invigorating and peaceful, in line with my preference for simple and clear steps in life.",0,no_event,Pick up phone to call friends,3,10801.0,same_t,0.0
"If not, prepare a meal or order delivery",Set the table for dinner,"I'm sitting comfortably in my modest living room, the sunlight casting a warm glow over everything, as I gently set the table for dinner, feeling a serene sense of relief in the quiet simplicity of my retirement life.",1,negative,"If not, prepare a meal or order delivery",3,14401.0,same_t,0.0
Stay at home as the weather is conducive and there is no urgency to move.,Prepare a simple meal considering the late hour and low energy expenditure typically associated with retirement.,"I'm sitting quietly in my cozy home, the morning sun filtering through the window, as I prepare a simple meal, my hands steady despite the late hour, a contented calm settling over me despite the lingering fear from past experiences.",1,positive,Stay at home as the weather is conducive and there is no urgency to move.,3,14401.0,same_t,0.0
Stay at home as location,Begin the morning routine,"I'm sipping my morning tea, the sun's gentle rays streaming through the window, feeling a sense of contentment as I start my day in the quiet of my home, knowing I can rely on my familiar surroundings and the assistance of those close to me for any challenges that may arise.",0,no_event,Stay at home as location,3,18001.0,same_t,0.0
Stay home as it's already the target location,,,0,no_event,Stay home as it's already the target location,,,same_t,
